{
  "$schema": "./languages.schema.json",
  "$note": "PIPELINE-RAW spec — produced by the geo data pipeline Not directly consumed by codegen / DcsvIo.D2.Geo.Default. A clean/transform pass to the sibling contracts/geo/languages.spec.json (one level up) is a separate step. Sources: datasets/language-codes (PDDL — alpha2 + English name) + Wikidata SPARQL (CC0 — endonyms via P218 in own language) + CLDR cldr-core scriptMetadata + languageData (Unicode-3.0 — writing direction via lang→primary script→rtl chain) + CLDR cldr-localenames-full/{locale}/languages.json (Unicode-3.0 — localized display names across the 11 supported locales). Missing: IsSupported (Tier 2 curated subset = the 11 supported langs), Deprecation. ISO 639-3 codes (3-letter) are deliberately excluded — the catalog ships ISO 639-1 only.",
  "catalogVersion": "0.0.1",
  "generatedAt": "2026-05-24T03:19:25.414Z",
  "sources": [
    {
      "name": "datasets-language-codes",
      "url": "https://raw.githubusercontent.com/datasets/language-codes/main/data/language-codes.csv",
      "license": "PDDL-1.0 (Open Knowledge Foundation Public Domain Dedication)",
      "fetchedAt": "2026-05-23T13:54:01.673Z",
      "sha256": "34e9dde2efbb37abd8c24d47a8693063579f706836fbe694557ecdbf1bfc53f2"
    },
    {
      "name": "wikidata",
      "url": "https://query.wikidata.org/sparql",
      "license": "CC0-1.0 (Wikidata)",
      "fetchedAt": "2026-05-23T13:54:02.606Z",
      "sha256": "25589bd424ef0ddf1fa6638136fd858a9b82d700023e800d6ea1e4fa26f8bc75"
    },
    {
      "name": "cldr-core",
      "url": "https://raw.githubusercontent.com/unicode-org/cldr-json/main/cldr-json/cldr-core/scriptMetadata.json",
      "license": "Unicode-3.0 (Unicode License)",
      "fetchedAt": "2026-05-23T13:54:02.792Z",
      "sha256": "9160c07c87f58495f57076c88231f63c1c062672991822671c9e99697b5e5cda"
    },
    {
      "name": "cldr-core",
      "url": "https://raw.githubusercontent.com/unicode-org/cldr-json/main/cldr-json/cldr-core/supplemental/languageData.json",
      "license": "Unicode-3.0 (Unicode License)",
      "fetchedAt": "2026-05-23T13:54:02.854Z",
      "sha256": "249e39c6bc9dff82cdd36348039b23e0f4ba9df0f3cea9a5857f00ed4253f6af"
    },
    {
      "name": "cldr-localenames-full",
      "url": "https://raw.githubusercontent.com/unicode-org/cldr-json/main/cldr-json/cldr-localenames-full/main/en/languages.json",
      "license": "Unicode-3.0 (Unicode License)",
      "fetchedAt": "2026-05-23T13:54:03.020Z",
      "sha256": "a5960d2371bc7d982da7fcfd9a0e237429d3467a5cc76f680bc3af5bcef9fb4e"
    },
    {
      "name": "cldr-localenames-full",
      "url": "https://raw.githubusercontent.com/unicode-org/cldr-json/main/cldr-json/cldr-localenames-full/main/es/languages.json",
      "license": "Unicode-3.0 (Unicode License)",
      "fetchedAt": "2026-05-23T13:54:03.130Z",
      "sha256": "fd5b463e664c4d21c40eb4a8e8cff1b355654057275853c644762104de059a37"
    },
    {
      "name": "cldr-localenames-full",
      "url": "https://raw.githubusercontent.com/unicode-org/cldr-json/main/cldr-json/cldr-localenames-full/main/fr/languages.json",
      "license": "Unicode-3.0 (Unicode License)",
      "fetchedAt": "2026-05-23T13:54:03.238Z",
      "sha256": "49c4f489e321f62ec64e3950045225a6aa2d4accc71584dfde262083679215d9"
    },
    {
      "name": "cldr-localenames-full",
      "url": "https://raw.githubusercontent.com/unicode-org/cldr-json/main/cldr-json/cldr-localenames-full/main/de/languages.json",
      "license": "Unicode-3.0 (Unicode License)",
      "fetchedAt": "2026-05-23T13:54:03.344Z",
      "sha256": "86f24c579d26d91e0a8176f2b2509bb224c97a538097d2cfa197f310c2c2b5b1"
    },
    {
      "name": "cldr-localenames-full",
      "url": "https://raw.githubusercontent.com/unicode-org/cldr-json/main/cldr-json/cldr-localenames-full/main/it/languages.json",
      "license": "Unicode-3.0 (Unicode License)",
      "fetchedAt": "2026-05-23T13:54:03.516Z",
      "sha256": "b7d56e70b5d867b44f5e177919fe1f08019cae2e714eefa7c9805fb2851e32c4"
    },
    {
      "name": "cldr-localenames-full",
      "url": "https://raw.githubusercontent.com/unicode-org/cldr-json/main/cldr-json/cldr-localenames-full/main/ja/languages.json",
      "license": "Unicode-3.0 (Unicode License)",
      "fetchedAt": "2026-05-23T13:54:03.695Z",
      "sha256": "bae312aec4c1c01c8e64d9f89217c753f7a250c7f379b2151854fedd5e06b080"
    },
    {
      "name": "cldr-localenames-full",
      "url": "https://raw.githubusercontent.com/unicode-org/cldr-json/main/cldr-json/cldr-localenames-full/main/nl/languages.json",
      "license": "Unicode-3.0 (Unicode License)",
      "fetchedAt": "2026-05-23T13:54:03.866Z",
      "sha256": "a476582e90ec89b30f6d75e3a8012680be3cf0c3e17e6fcfea850ea9d8b7aeda"
    },
    {
      "name": "cldr-localenames-full",
      "url": "https://raw.githubusercontent.com/unicode-org/cldr-json/main/cldr-json/cldr-localenames-full/main/ko/languages.json",
      "license": "Unicode-3.0 (Unicode License)",
      "fetchedAt": "2026-05-23T13:54:03.986Z",
      "sha256": "0b86d3cd04aa391b126b501a87acdb14f111b65c4b2a5b17e6ed85f0e03030b2"
    },
    {
      "name": "cldr-localenames-full",
      "url": "https://raw.githubusercontent.com/unicode-org/cldr-json/main/cldr-json/cldr-localenames-full/main/zh/languages.json",
      "license": "Unicode-3.0 (Unicode License)",
      "fetchedAt": "2026-05-23T13:54:04.110Z",
      "sha256": "c38a6432f03549aa933674bba9880e3bae890135922231775818ae5cbe7b3ee3"
    },
    {
      "name": "cldr-localenames-full",
      "url": "https://raw.githubusercontent.com/unicode-org/cldr-json/main/cldr-json/cldr-localenames-full/main/pt/languages.json",
      "license": "Unicode-3.0 (Unicode License)",
      "fetchedAt": "2026-05-23T13:54:04.246Z",
      "sha256": "51a16f17d1237bc91ad87ec0c4baed49df119bdcde225dc7dfe315bae6dbd207"
    },
    {
      "name": "cldr-localenames-full",
      "url": "https://raw.githubusercontent.com/unicode-org/cldr-json/main/cldr-json/cldr-localenames-full/main/pl/languages.json",
      "license": "Unicode-3.0 (Unicode License)",
      "fetchedAt": "2026-05-23T13:54:04.372Z",
      "sha256": "4717ff668c5bfcc5dc883d4cd94fa73b21934892ed8f76b4eb55794b600909c0"
    }
  ],
  "fieldCoverage": {
    "iso6391Code": {
      "populated": 183,
      "total": 183,
      "pct": "100.0%"
    },
    "displayName": {
      "populated": 183,
      "total": 183,
      "pct": "100.0%"
    },
    "endonymDisplayName": {
      "populated": 170,
      "total": 183,
      "pct": "92.9%"
    },
    "writingDirection": {
      "populated": 180,
      "total": 183,
      "pct": "98.4%"
    },
    "primaryScriptISO15924Code": {
      "populated": 180,
      "total": 183,
      "pct": "98.4%"
    },
    "localizedDisplayNames_en": {
      "populated": 183,
      "total": 183,
      "pct": "100.0%"
    },
    "localizedDisplayNames_ja": {
      "populated": 183,
      "total": 183,
      "pct": "100.0%"
    },
    "localizedDisplayNames_zh": {
      "populated": 183,
      "total": 183,
      "pct": "100.0%"
    }
  },
  "entries": [
    {
      "iso6391Code": "aa",
      "displayName": "Afar",
      "endonymDisplayName": "Qafár af",
      "writingDirection": "LTR",
      "primaryScriptISO15924Code": "Latn",
      "localizedDisplayNames": {
        "en": "Afar",
        "es": "afar",
        "fr": "afar",
        "de": "Afar",
        "it": "afar",
        "ja": "アファル語",
        "nl": "Afar",
        "ko": "아파르어",
        "zh": "阿法尔语",
        "pt": "afar",
        "pl": "afar"
      },
      "_provenance": {
        "sources": [
          "datasets/language-codes",
          "wikidata-sparql",
          "cldr-script-language-data",
          "cldr-localenames-full"
        ],
        "extractedAt": "2026-05-24T03:19:25.405Z"
      }
    },
    {
      "iso6391Code": "ab",
      "displayName": "Abkhazian",
      "endonymDisplayName": "Аԥсуа бызшәа",
      "writingDirection": "LTR",
      "primaryScriptISO15924Code": "Cyrl",
      "localizedDisplayNames": {
        "en": "Abkhazian",
        "es": "abjasio",
        "fr": "abkhaze",
        "de": "Abchasisch",
        "it": "abcaso",
        "ja": "アブハズ語",
        "nl": "Abchazisch",
        "ko": "압카즈어",
        "zh": "阿布哈西亚语",
        "pt": "abcázio",
        "pl": "abchaski"
      },
      "_provenance": {
        "sources": [
          "datasets/language-codes",
          "wikidata-sparql",
          "cldr-script-language-data",
          "cldr-localenames-full"
        ],
        "extractedAt": "2026-05-24T03:19:25.406Z"
      }
    },
    {
      "iso6391Code": "ae",
      "displayName": "Avestan",
      "endonymDisplayName": null,
      "writingDirection": "RTL",
      "primaryScriptISO15924Code": "Avst",
      "localizedDisplayNames": {
        "en": "Avestan",
        "es": "avéstico",
        "fr": "avestique",
        "de": "Avestisch",
        "it": "avestan",
        "ja": "アヴェスタ語",
        "nl": "Avestisch",
        "ko": "아베스타어",
        "zh": "阿维斯塔语",
        "pt": "avéstico",
        "pl": "awestyjski"
      },
      "_provenance": {
        "sources": [
          "datasets/language-codes",
          "cldr-script-language-data",
          "cldr-localenames-full"
        ],
        "extractedAt": "2026-05-24T03:19:25.406Z"
      }
    },
    {
      "iso6391Code": "af",
      "displayName": "Afrikaans",
      "endonymDisplayName": "Afrikaans",
      "writingDirection": "LTR",
      "primaryScriptISO15924Code": "Latn",
      "localizedDisplayNames": {
        "en": "Afrikaans",
        "es": "afrikáans",
        "fr": "afrikaans",
        "de": "Afrikaans",
        "it": "afrikaans",
        "ja": "アフリカーンス語",
        "nl": "Afrikaans",
        "ko": "아프리칸스어",
        "zh": "南非荷兰语",
        "pt": "africâner",
        "pl": "afrikaans"
      },
      "_provenance": {
        "sources": [
          "datasets/language-codes",
          "wikidata-sparql",
          "cldr-script-language-data",
          "cldr-localenames-full"
        ],